"Local – Boston News, Weather, Sports",
Columbine focuses on healing as questions loom after manhunt,"LITTLETON, Colo. (AP) — A Colorado community changed forever by the attack that killed 13 people at Columbine High School moved ahead Thursday with ceremonies marking the anniversary of the tragedy while awaiting more details on what led a Florida teen “infatuated” with the shooting to buy a shotgun and kill herself in the snowy foothills nearby.

Many questions remained unanswered about 18-year-old Sol Pais, but a friend disputed the contention by authorities that she posed a threat.

Adrianna Pete painted a complex picture of Pais, saying she was deeply troubled, lonely and often talked about suicide but was also brilliant, kind and a talented artist who loved to draw.

Pete, 19, a college student in Carleton, Michigan, said she met Pais online two years ago through a mutual friend and quickly developed a friendship involving near-daily communication. They met in person twice, once when Pete traveled to Florida and once when Pais went to Michigan.

Pete faulted authorities for overreacting in portraying Pais as a threat based on her activities before her death.

“She never threatened anyone,” Pete said. “There are no credible threats and only assumptions that she was just because the word Columbine was included.”

Pete said Pais had a weird obsession with the Columbine killers but that didn’t mean she was planning an attack. The killers were “someone she could relate to” because they were lonely, not because of their violence, Pete said.

“She would say I hate life, life sucks and that she was very alone,” Pete said. “Then she told me she had it figured out with her parents before so I assumed like she was doing OK … She actually posted about it a lot, wanting to die.”

Two teenagers attacked Columbine on April 20, 1999, killing 12 classmates and a teacher before taking their own lives. They have inspired cult-like admirers, some of whom committed other mass shootings.

The days surrounding the April 20 anniversary of the attack are always emotional for school alumni, their families and the suburban community of Littleton surrounding Columbine. Some survivors describe the experience as an “April fog.”

The manhunt for Pais and the resulting closure of schools added a new layer of anxiety, former Columbine principal Frank DeAngelis said Wednesday after the FBI declared the danger was over.

A religious service Thursday night will begin three days of commemorative events themed “Remember. Reflect. Recommit” leading to a day of community service projects and a ceremony Saturday at a park near the school.

Pais’ body was discovered Wednesday in the mountains outside Denver with what appeared to be a self-inflicted gunshot wound.

Colorado authorities learned about Pais on Tuesday from an alarmed Miami FBI office that had interviewed people about her obsession with the Columbine shooting.

Dozens of schools, including Columbine, locked their doors for several hours on Tuesday and even more closed altogether on Wednesday.

More than 400,000 students returned to Denver-area schools Thursday, with visible police presence outside buildings.

FBI officials declined Wednesday to discuss Pais’ mental health or detail the comments she made indicating an “infatuation” with the Columbine shooting. An FBI spokeswoman did not immediately respond to a request Thursday for more information on Pais’ background or her Columbine-related comments that sparked a rapid law enforcement response.

Officials at her Florida school district said they had no record of Pais being contacted by law enforcement or disciplined in school.

Her family has not spoken publicly but worked with authorities this week.

Pete described Pais as caring and thoughtful, someone who helped with her Spanish homework and sent her a pair of earrings when she was having boyfriend troubles.

When they got together in Miami last summer, they went swimming at the beach, walked the boardwalk and played with stray cats. Almost daily, Pais walked to a store and bought a coffee energy drink. She was obsessed with them, Pete said.

“I believe she was just very mentally ill and had no one but me to confide in and a few people on the internet,” Pete said.

FBI officials said Wednesday they were reviewing all of Pais’ activity in recent weeks, including her social media accounts and other online writing. They confirmed that online material includes a blog featuring hand-written journal entries about the author’s unhappiness and desire to die along with sketches of guns or knives.

Pais did not make threats against a specific school but her history and purchase of a weapon immediately after arriving in Colorado merited a broad response, officials said.

Pais arrived Monday and went directly to a gun store, where she bought a shotgun, authorities said. The purchase apparently followed the legal process, officials said.

(Copyright (c) 2019 The Associated Press. All Rights Reserved. This material may not be published, broadcast, rewritten, or redistributed.)"
Former Vice President Joe Biden is expected to announce he’s running for president next week,"WASHINGTON (AP) — Former Vice President Joe Biden is expected to announce he’s running for president next week.

That’s according to three people with knowledge of Biden’s plans.

Biden will enter the race as a Democratic front-runner, although the 76-year-old faces questions about his age and whether his more moderate record fits with a party that has become more liberal.

The announcement is expected as early as Wednesday and would cap months of deliberation over his political future.

The people with knowledge of Biden’s plans insisted on anonymity because they were not authorized to speak publicly.

The Atlantic first reported Biden’s decision.

(Copyright (c) 2019 The Associated Press. All Rights Reserved. This material may not be published, broadcast, rewritten, or redistributed.)"
"Trump – Boston News, Weather, Sports","WASHINGTON (AP) — Amid growing concern about the risks of Google and other U.S. companies doing business in China, President Donald Trump said Wednesday thatRead More"
Mueller reveals Trump’s attempts to choke off Russia probe,"WASHINGTON (AP) — Public at last, special counsel Robert Mueller’s report revealed to a waiting nation Thursday that President Donald Trump tried to seize control of the Russia probe and force Mueller’s removal to stop him from investigating potential obstruction of justice by the president. Trump was largely thwarted by those around him who refused to go along.

Mueller laid out multiple episodes in which Trump directed others to influence or curtail the Russia investigation after the special counsel’s appointment in May 2017. Those efforts “were mostly unsuccessful, but that is largely because the persons who surrounded the President declined to carry out orders or accede to his requests,” Mueller wrote.

After nearly two years, the two-volume, 448-page redacted report made for riveting reading.

In one particularly dramatic moment, Mueller reported that Trump was so agitated at the special counsel’s appointment on May 17, 2017, that he slumped back in his chair and declared: “Oh my God. This is terrible. This is the end of my presidency. I’m f—ed.”

With that, Trump set out to save himself.

In June of that year, Mueller wrote, Trump directed White House Counsel Don McGahn to call Deputy Attorney General Rod Rosenstein, who oversaw the probe, and say that Mueller must be ousted because he had conflicts of interest. McGahn refused — deciding he would sooner resign than trigger a potential crisis akin to the Saturday Night Massacre of firings during the Watergate era.

Two days later, the president made another attempt to alter the course of the investigation, meeting with former campaign manager Corey Lewandowski and dictating a message for him to relay to then-Attorney General Jeff Sessions. The message: Sessions would publicly call the investigation “very unfair” to the president, declare Trump did nothing wrong and say Mueller should limit his probe to “investigating election meddling for future elections.” The message was never delivered.

The report’s bottom line largely tracked the findings revealed in Attorney General William Barr’s four-page memo released a month ago — no collusion with Russia but no clear verdict on obstruction — but it added new layers of detail about Trump’s efforts to thwart the investigation. Looking ahead, both sides were already using the findings to amplify well-rehearsed arguments about Trump’s conduct, Republicans casting him as a victim of harassment and Democrats depicting the president as stepping far over the line to derail the investigation.

The Justice Department released its redacted version of the report about 90 minutes after Barr offered his own final assessment of the findings at a testy news conference. The nation, Congress and Trump’s White House consumed it voraciously — online, via a compact disc delivered to legislators and in loose-leaf binders distributed to reporters.

The release represented a moment of closure nearly two years in the making but also the starting bell for a new round of partisan warfare.

A defiant Trump pronounced it “a good day” and tweeted “Game Over” in a typeface mimicking the “Game of Thrones” logo. By late afternoon, he was airborne for his Mar-a-Lago private club in Florida with wife Melania for the holiday weekend.

Top Republicans in Congress saw vindication, too.

House Minority Leader Kevin McCarthy said it was time to move on from Democrats’ effort to “vilify a political opponent.” The California lawmaker said the report failed to deliver the “imaginary evidence” incriminating Trump that Democrats had sought.

Trump campaign manager Brad Parscale said Republicans should turn the tables and “investigate the liars who instigated this sham investigation.”

But Democrats cried foul over Barr’s preemptive press conference and said the report revealed troubling details about Trump’s conduct in the White House.

In a joint statement, House Speaker Nancy Pelosi and Senate Democratic leader Chuck Schumer wrote that “one thing is clear: Attorney General Barr presented a conclusion that the president did not obstruct justice while Mueller’s report appears to undercut that finding.”

House Judiciary Chairman Jerrold Nadler added that the report “outlines disturbing evidence that President Trump engaged in obstruction of justice and other misconduct.” He sent a letter to the Justice Department requesting that Mueller himself testify before his panel “no later than May 23” and said he’d be issuing a subpoena for the full special counsel report and the underlying materials.

Signaling battles ahead, Nadler earlier called the investigation “incredibly thorough” work that would preserve evidence for future probes.

Barr said he wouldn’t object to Mueller testifying.

Trump himself was never questioned in person, but the report’s appendix includes 12 pages of his written responses to queries from Mueller’s team.

Mueller deemed Trump’s written answers — rife with iterations of “I don’t recall” — to be “inadequate.” He considered issuing a subpoena to force the president to appear in person but decided against it after weighing the likelihood of a long legal battle.

In his written answers, Trump said his comment during a 2016 political rally asking Russian hackers to help find emails scrubbed from Hillary Clinton’s private server was made “in jest and sarcastically” and said he did not recall being told during the campaign of any Russian effort to infiltrate or hack computer systems.

But Mueller said that within five hours of Trump’s comment, Russian military intelligence officers were targeting email accounts connected to Clinton’s office.

Mueller evaluated 10 episodes for possible obstruction of justice, and said he could not conclusively determine that Trump had committed criminal obstruction. The episodes included Trump’s firing of FBI Director James Comey, the president’s directive to subordinates to have Mueller fired and efforts to encourage witnesses not to cooperate.

Sessions was so affected by Trump’s frequent criticism of him for recusing himself from the investigation that he kept a resignation letter “with him in his pocket every time he went to the White House,” Mueller said.

The president’s lawyers have said Trump’s conduct fell within his constitutional powers, but Mueller’s team deemed the episodes deserving of scrutiny for potential criminal acts.

As for the question of whether the Trump campaign had colluded with Russia during the 2016 presidential campaign, Mueller wrote that the campaign “expected it would benefit electorally from information stolen and released through Russian efforts.”

But Mueller said investigators concluded, “While the investigation identified numerous links between individuals with ties to the Russian government and individuals associated with the Trump Campaign, the evidence was not sufficient to support criminal charges.”

Workers at a Russian troll farm contacted Trump’s campaign, claiming to be political activists for conservative grassroots organizations, and asked for signs and other campaign materials to use at rallies. While volunteers provided some of those materials — and set aside a number of signs — investigators don’t believe any Trump campaign officials knew the requests were coming from foreign nationals, Mueller wrote.

Mueller wrote that investigators “did not establish that members of the Trump campaign conspired or coordinated with the Russian government in its election interference activities.”

Josh Blackman, a professor at the South Texas College of Law Houston, stressed that Mueller didn’t think the president’s obligations to run the executive branch entitled him to absolute immunity from prosecution. But to find that the president obstructed justice, he said, Mueller would have needed much clearer evidence that the president acted solely with “corrupt intent.”

“The evidence was sort of muddled,” Blackman said, adding that the president’s actions had multiple motivations.

The report laid out some of Mueller’s reasoning for drawing no conclusion on the question of obstruction.

Mueller wrote that he would have exonerated Trump if he could, but he wasn’t able to do that given the evidence he uncovered. And he said the Justice Department’s standing opinion that a sitting president couldn’t be indicted meant he also couldn’t recommend Trump be criminally charged, even in secret.

Trump’s written responses addressed no questions about obstruction of justice, as was part of an agreement with Trump’s legal team.

He told Mueller he had “no recollection” of learning in advance about the much-scrutinized Trump Tower meeting between campaign officials and a Russian lawyer. He also said he had no recollection of knowledge about emails setting up the meeting that promised dirt on Clinton’s Democratic campaign.

He broadly denied knowing of any foreign government trying to help his campaign, including the Russian government. He said he was aware of some reports that Russian President Vladimir Putin had made “complimentary statements” about him.

It wasn’t just Trump under the microscope. But Mueller wrote that he believed prosecutors would be unlikely to meet the burden of proof to show that Donald Trump Jr. and other participants in the Trump Tower meeting “had general knowledge that their conduct was unlawful.” Nor did Mueller’s probe develop evidence that they knew that foreign contributions to campaigns were illegal or other particulars of federal law.

Barr’s contention that the report contained only “limited redactions” applied more to the obstruction of justice section than its look at Russian election meddling. Overall, about 40 percent of the pages contained at least something that was blocked out, mostly to protect ongoing investigations. Barr had said that he would redact grand jury information and material related to investigations, privacy and intelligence.

(Copyright (c) 2019 The Associated Press. All Rights Reserved. This material may not be published, broadcast, rewritten, or redistributed.)"
President who cried wolf? Real border alarms now seem hollow,"WASHINGTON (AP) — When President Donald Trump insisted last year that America’s southern border was in crisis, his warnings landed with a thud.

Making unverified claims about “unknown Middle Easterners” and prayer rugs found by ranchers, Trump drew eye rolls from Democrats and many others, who derided his tactics as little more than an election-year stunt .

Now, six months later, Trump’s new cries of alarm are again being met with skepticism, though the situation at the border has indeed deteriorated. Lawmakers of both parties agree there is a genuine humanitarian emergency, with federal authorities and nonprofits unable to cope with the tens of thousands of Central American families seeking refuge in the U.S.

It’s a classic case of the boy who cried wolf.

No wonder the public is skeptical, says Rep. Pete Aguilar, D-Calif. “There’s a humanitarian crisis and I think that there are steps we can take to help. Unfortunately the president has never been an honest broker about any of these solutions. He plays fast and loose with the facts.”

Trump and members of his administration have spent years blaming Democrats for failing to work with them to close what they describe as “loopholes” that encourage migrants to make the dangerous trek to the U.S. and that restrict the government’s ability to remove them once they arrive.

“Democrats in Congress must return from their Vacations and change the Immigration Laws, or the Border, despite the great job being done by Border Patrol, will only get worse,” Trump tweeted again on Wednesday.

But Democratic lawmakers and immigration activists say that, after years of incendiary comments and false starts, there is little appetite for cooperation with Trump on an issue that has vexed lawmakers for decades. The president, they say, has not only squandered potential goodwill, but also failed to demonstrate that he is genuinely interested in potential solutions.

Many also accuse the president of simply stoking the issue for his political benefit to energize his base and boost turnout ahead of his 2020 re-election race.

Democrats note, in particular, the president’s threat to send migrants immigration-friendly “sanctuary cities” in an effort to punish political foes as the starkest example of why they don’t trust the administration.

“The problem is he has made it political. He’s made it all about political revenge,” said Rep. Nanette Barragan, D-Calif., who sits on the Homeland Security committee. She said that Democrats would be happy to work with the White House to address the problem, but not under the current circumstances.

“If he’s truly interested in the southern border right now and what has been happening, then these policies need to change, this rhetoric has to change,” she said.

Aguilar, the congressman from California, said that if the White House were really serious, it would propose legislative language on potential changes it wants for Congress to review and debate.

There does appear at least to be discussion underway.

Last Wednesday, acting White House chief of staff Mick Mulvaney and acting Homeland Security Secretary Kevin McAleenan met with several Democratic senators to discuss border security, said an aide to No. 2 Senate Democratic leader Dick Durbin of Illinois. The aide, who spoke on condition of anonymity to describe a closed door meeting, said the talks were in early stages.

Other senators in the one-hour session included California’s Dianne Feinstein, in whose office the session was held, Jon Tester of Montana and Kyrsten Sinema of Arizona.

For the most part, critics say, Trump has instead pushed ideas that have made things worse. Those include cutting off aid money to the Central American countries that migrants are fleeing; limiting asylum claims at legal ports of entry, which encourages migrants to cross illegally elsewhere, and threatening to completely close southern border crossings, which could have the same affect.

“The problem is we’re dealing with an administration that doesn’t want a solution,” said Rep. Ruben Gallego, D-Ariz. He argued the administration could be doing far more to address the immediate crisis including incentivizing people to apply for asylum in their home countries so they don’t make the journey north, dedicating more resources to border facilities to process new arrivals and hiring more immigration judges to clear the backlog of asylum cases.

Some have also called for mobilizing FEMA and the Red Cross to help provide housing and health care as the government would in a natural disaster.

“Solutions aren’t really that hard,” Gallego said.

Meanwhile, Trump continues to portray asylum-seekers as dangerous figures trying to game the U.S. immigration system.

“You look at some of these people; you want protection from them. And they’re saying, ‘We need protection from our country,” Trump said this week. “It’s a big con job. That’s what it is.”

“Trump’s rhetoric poisons the well for any deal making,” said Frank Sharry, the executive director of America’s Voice, a liberal immigration reform group, which soured on working with Trump after he backed out of a bipartisan 2018 congressional deal that would have provided legal protection for hundreds of thousands of “dreamer” immigrants brought to the country as children and now here illegally.

“He’s leveraging chaos for political advantage,” Sharry said.

Indeed, Sharry said he has a difficult time using the word “crisis” to describe the current situation because it has become so politically charged.

“Here is an asylum emergency at the border,” he said instead.

The White House didn’t respond to requests for comment Wednesday. But in Africa, Ivanka Trump, the president’s daughter and senior adviser told the AP that “there is no one solution to solving this problem.”

“We have a humanitarian crisis at our southern border of epic proportion,” she said. “Ultimately it’s going to have to be done in Congress to change the laws that enable us to maintain secure borders and ensure that there’s adequate humanitarian assistance and relief for those who are struggling and seeking legitimate asylum in our country.”

(Copyright (c) 2019 The Associated Press. All Rights Reserved. This material may not be published, broadcast, rewritten, or redistributed.)"
