"Local – Boston News, Weather, Sports",
‘A good day’: Trump claims victory with Mueller report out,"WASHINGTON (AP) — Before the world glimpsed the redacted version of the special counsel’s report, President Donald Trump tried once more to frame the moment as a political victory.

The 448-page report does include an account of how the president attempted to seize control of the investigation into Russian interference in the 2016 U.S. election and force out Robert Mueller from leading the inquiry. But that didn’t stop Trump from taking a public victory lap Thursday, declaring at a White House event that he was having “a good day.”

“It was called no collusion, no obstruction. There never was, by the way, and there never will be,” Trump said at a gathering of wounded veterans. “This should never happen to another president again, this hoax.”

Twelve times Trump took to Twitter in the hours before Attorney General William Barr outlined the findings of the report. The president proclaimed his innocence and insisted that the investigation was politically motivated. As soon as Barr concluded his remarks, and more than an hour before Mueller’s report was released, Trump tweeted a taunt over an image inspired by the HBO show “Game of Thrones.”

“No Collusion. No Obstruction,” it said. “For the haters and the radical left Democrats — Game Over.”

It is true that Mueller did not charge that Trump’s campaign colluded with Russia. And Barr and Deputy Attorney General Rod Rosenstein, in the attorney general’s four-page summary of the Mueller report that was released last month, declined to charge obstruction of justice.

But the two-volume does recount how Trump repeatedly sought to take control of an investigation that has hovered over the first two years of his presidency.

Mueller reported that Trump had been agitated at the investigation from the start. Trump reacted to Mueller’s appointment by saying it was the “end of his presidency.”

The report said that in June 2017, Trump directed White House counsel Don McGahn to call Rosenstein, who oversaw the investigation, and say that Mueller must be ousted because Mueller had conflicts of interest. McGahn refused, deciding he would rather resign than trigger what he regarded as a potential repeat of the Saturday Night Massacre firings from Watergate. During that crisis, President Richard Nixon first ordered his attorney general, and then the deputy, to fire the Watergate special prosecutor; they refused and quit on a weekend, but did not derail the independent investigation or Nixon’s collapse for long.

As for the question of whether Trump’s campaign had colluded with Russia during the 2016 presidential race, Mueller wrote: “While the investigation identified numerous links between individuals with ties to the Russian government and individuals associated with the Trump Campaign, the evidence was not sufficient to support criminal charges.”

At Justice Department headquarters, reporters buzzed around, hearing from Barr and awaiting the Mueller report. A few blocks away, there was calm on one of the defining days of Trump’s presidency

The news media were led into the White House East Room, just before the report came out, for Trump’s appearance with wounded warriors. While newsrooms across the country digested the report, the White House guests, already seated while waiting for the president to arrive, were entertained by the U.S. Marine Band. Among the selections played: “Somewhere Over the Rainbow.”

Democrats criticized Barr for a news conference they said amounted to an attempt to frame the findings before the report was released. But it appeared to be the latest move by Trump and his allies to try and shape the narrative surrounding the investigation — featuring his incessant tweeting of “No Collusion” and his attacks on the credibility of the investigators in hopes of undermining their findings.

The White House seized upon Barr’s four-page summary last month as vindication and played down the contents of the report itself.

“Knockout,” read a text message from Rudy Giuliani, one of the president’s attorneys, to reporters after Barr finished speaking.

A further statement from Giuliani and Trump’s lawyers said “the report itself is nothing more than an attempt to rehash old allegations” and insisted that “the results of the investigation are a total victory for the president.”

Trump’s re-election campaign manager, Brad Parscale, said, “Now the tables have turned, and it’s time to investigate the liars who instigated this sham investigation into President Trump, motivated by political retribution and based on no evidence whatsoever.”

The president and his allies have portrayed House Democrats’ investigations as partisan overreach. They have targeted news outlets and individual reporters they say have promoted the collusion story. The president seethed at a recent political rally that the whole thing was an attempt “to tear up the fabric of our great democracy.”

He has told confidants in recent days that he was certain the full report would back up his claims of vindication but was also convinced that the media would manipulate the findings in an effort to damage him.

(Copyright (c) 2019 The Associated Press. All Rights Reserved. This material may not be published, broadcast, rewritten, or redistributed.)"
Red Sox place Dustin Pedroia on injured list,"BOSTON (WHDH) - The Boston Red Sox will place second baseman Dustin Pedroia on the 10-day injured list, the team announced Thursday night.

Pedroia, 35, began the season on the injured list with left knee inflammation.

After returning from an injury rehab assignment with Single-A Greenville and reinstated from the injured list on April 9, he appeared in six games with Boston.

Pedroia made four starts at second base and two as a designated hitter, going 2-for-20 (.100) with a walk, an RBI, and a run scored.

The three-time World Series champion and four-time Rawlings Gold Glove Award winner appeared in only three major league games in 2018 due to a pair of stints on the disabled list.

To fill Pedroia’s spot on the active 25-man roster, the club will recall right-handed pitcher Marcus Walden from Triple-A Pawtucket prior to Friday’s game against the Tampa Bay Rays.

(Copyright (c) 2019 Sunbeam Television. All Rights Reserved. This material may not be published, broadcast, rewritten, or redistributed.)"
Gronkowski dents Lombardi Trophy by using it as bat during Red Sox home opener,"New England Patriots' Julian Edelman (11) and Rob Gronkowski (87) lift Super Bowl trophies between Danny Etling, left, and Deatrich Wise, right, before the home opener baseball game between the Red Sox and the Toronto Blue Jays, Tuesday, April 9, 2019, in Boston. (AP Photo/Charles Krupa)

BOSTON (WHDH) - Former New England Patriots tight end Rob Gronkowski made sure to leave one last mark on the organization as he entered retirement.

During the Boston Red Sox home opener at Fenway Park, Gronkowski decided to use the Patriots’ sixth Lombardi Trophy as a baseball bat.

In video released by the Patriots on Twitter, Gronkowski is seen using the trophy to bunt a baseball thrown by wide receiver Julian Edelman as they practiced their first pitches for the game.

Gronkowski’s teammates, including cornerback Jascon McCourty and defensive back Duron Harmon, watched this unfold and didn’t think he would actually swing the trophy.

“We’re thinking, ‘He’s not going to swing the bat. He’s not going to do it,'” Harmon recalled.

The hit left the football part of the Lombardi Trophy dented.

McCourty referred to the dent as “Gronkowski’s parting gift.”

“He has now left an everlasting mark so people will never forget that he was a part of that championship team,” Harmon added.

Several players attended the home opener on April 9 to celebrate their Super Bowll LIII victory against the Los Angeles Rams.

.@RobGronkowski left a mark on this organization. And on the sixth Lombardi. pic.twitter.com/t5IVTyCXcA — New England Patriots (@Patriots) April 17, 2019

(Copyright (c) 2019 Sunbeam Television. All Rights Reserved. This material may not be published, broadcast, rewritten, or redistributed.)"
Judge bars release of Kraft massage videos before hearing,"FORT LAUDERDALE, Fla. (AP) — Prosecutors can’t release undercover video of New England Patriots owner Robert Kraft and others allegedly receiving sex acts at a Florida massage parlor until a Florida judge rules later this month.

Circuit Judge Joseph Marx on Wednesday barred the release of any video from the Orchids of Asia Day Spa before an April 29 hearing where he will hear from all parties, the Palm Beach Post reported.

Palm Beach County prosecutors had filed a notice in a related case saying they believe the videos are public records under Florida law and plan to release pixilated versions — a move Kraft’s attorneys quickly moved to block, accusing prosecutors of apparent “gross prosecutorial misconduct.”

Kraft was charged in February with two misdemeanor counts of soliciting prostitution for allegedly paying for sex at the Orchids of Asia Day Spa in Jupiter, Florida. He has pleaded not guilty. Twenty-four other alleged Orchids of Asia customers were similarly charged.

Palm Beach State Attorney David Aronberg wrote to the court in the related case that there is no legal basis to block the videos’ release. The Associated Press and numerous other media outlets have requested the videos.

“Absent a Court order, the State will be releasing the requested public records” after they are pixilated, Aronberg wrote. His spokesman, Mike Edmondson, said the release is not imminent as the office is processing numerous public records requests from the case.

Defense attorney Jack Goldberger quickly sent a letter to the judge overseeing Kraft’s case, writing that prosecutors are trying to “evade judicial review and end run” around a promise he says they made to await a court ruling on whether the videos are a public record.

“The State’s bad faith attempt to circumvent judicial review by simply releasing the Videos” before the judge rules “is an affront to justice and grossly unethical,” Goldberger wrote.

David S. Weinstein, a defense attorney and former prosecutor who is not involved in the case, said “there is still no guarantee that the tapes will be released.” Prosecutors “are simply stating that they are complying with their duties under the public records laws and they won’t be withholding the tapes,” he said. Even if the trial judge orders the videos’ release, Kraft’s attorneys could appeal, he said.

Kraft, 77, is accused of paying for sex acts at the spa twice in January. While fighting the charges, he recently issued an apology saying he had disappointed his family, friends, co-workers, fans “and many others who rightfully hold me to a higher standard.”

Kraft said he has “extraordinary respect for women,” adding that his morals were shaped by his late wife, who died in 2011.

According to police records, Kraft, who is worth $6 billion, was chauffeured to the Orchids of Asia spa on the evening of Jan. 19, where officers secretly recorded him engaging in a sex act and then handing over an undetermined amount of cash.

Investigators said Kraft returned 17 hours later and was again videotaped engaging in sex acts before paying with a $100 bill and another bill, police said.

Hours later, he was in Kansas City for the AFC Championship game, where his Patriots defeated the Chiefs. His team then won the Super Bowl in Atlanta, the Patriots’ sixth NFL championship under his ownership.

Goldberger has previously accused Jupiter police of having “deliberately misrepresented” facts used to get a judge to approve the warrant allowing the cameras’ secret installation. Officers used an undisclosed ruse to gain access to the spa days before Kraft’s visits.

Jupiter was part of a multicounty investigation of massage parlor prostitution and possible human trafficking that resulted with the arrests of about 300 men and the closure of 10 spas. The spa owners have been charged with felonies. Prosecutors have conceded they found no evidence of human trafficking at the Jupiter spa.

Goldberger also said officers did not exhaust less-invasive means of investigating the spa, and Florida law says audio surveillance such as wiretaps should only be used for serious felonies such as murder or kidnapping and does not list prostitution.

Prosecutors have offered to drop the charges if Kraft enters a diversion program for first-time offenders, as some others charged have. That would include an admission he would be found guilty if the case went to trial, a $5,000 fine, 100 hours of community service and attendance in a class on the dangers of prostitution and its connection to human trafficking. He would also have to make a court appearance and be tested for sexually transmitted diseases.

Prosecutors have said the fine and community service are required by law and are not negotiable.

(Copyright (c) 2019 The Associated Press. All Rights Reserved. This material may not be published, broadcast, rewritten, or redistributed.)"
"Pastrnak scores twice, Bruins beat Maple Leafs to tie series","TORONTO (AP) — David Pastrnak scored twice in quick succession, Brad Marchand had a goal and two assists and the Boston Bruins held off the Toronto Maple Leafs 6-4 on Wednesday night to tie the first-round series 2-2.

Charlie McAvoy had a goal and an assist, Zdeno Chara and Joakim Nordstrom also scored and Tuukka Rask made 38 saves.

Auston Matthews scored twice for Toronto. Zach Hyman and Travis Dermott also scored and Frederik Andersen stopped 25 shots.

Game 5 is Friday night in Boston.

After the Maple Leafs overcame a 2-0 deficit to tie it early in the second period, Pastrnak put Boston back in front at 3:16 when he redirected a pass from Marchand on a 2-on-1. The Bruins then got a power play when Matthews went off for roughing, and Marchand whipped a backhand pass to a wide-open Pastrnak, who snapped the puck short-side on Andersen for his second goal in 1:35.

Chara made it 5-2 at 5:39 of the third. At 42 years, 30 days, the Boston captain became the second-oldest player in NHL history to score a playoff goal. Chris Chelios holds the record at 45 years, 86 days.

Matthews scored on the power play with 8:08 left, and Dermott made it 5-4 through traffic with 6:33 remaining. Nordstrom scored into an empty net with two seconds to go.

NOTES: Boston was 2 for 2 on the power play. Toronto went 1 for 3. … Boston: 2-2; Toronto: 1-3. … Canadian hip hop artist Drake and Toronto Raptors coach Nick Nurse attended the game.

(Copyright (c) 2019 The Associated Press. All Rights Reserved. This material may not be published, broadcast, rewritten, or redistributed.)"
